[{"id":1,"name":"Ondricka and Sons","industry":"n/a","active":false,"website":"https://twitpic.com","telephone":"626-135-8533","slogan":"Universal bandwidth-monitored orchestration","address":"71 Emmet Avenue","city":"Pasadena","country":"United States"},
{"id":2,"name":"Gusikowski, Cassin and Hagenes","industry":"Major Banks","active":false,"website":"http://google.nl","telephone":"858-157-2878","slogan":"Visionary dynamic infrastructure","address":"5053 Northland Circle","city":"San Diego","country":"United States"},
{"id":3,"name":"Osinski, Zulauf and Beier","industry":"Real Estate Investment Trusts","active":true,"website":"https://uol.com.br","telephone":"407-924-5777","slogan":"Networked national hub","address":"0 Kinsman Circle","city":"Kissimmee","country":"United States"},
{"id":4,"name":"Runolfsson LLC","industry":"Package Goods/Cosmetics","active":true,"website":"https://miitbeian.gov.cn","telephone":"616-430-4560","slogan":"Upgradable explicit parallelism","address":"9 Forster Crossing","city":"Grand Rapids","country":"United States"},
{"id":5,"name":"Mosciski LLC","industry":"Real Estate Investment Trusts","active":false,"website":"https://de.vu","telephone":"305-318-1615","slogan":"Ameliorated dedicated circuit","address":"68 Oxford Circle","city":"Clearwater","country":"United States"},
{"id":6,"name":"Howe-Zboncak","industry":"Major Banks","active":false,"website":"http://accuweather.com","telephone":"611-768-4603","slogan":"Object-based optimizing initiative","address":"297 Dixon Lane","city":"Greater Napanee","country":"Canada"},
{"id":7,"name":"Kihn Inc","industry":"n/a","active":false,"website":"https://dailymail.co.uk","telephone":"303-598-4045","slogan":"Persistent foreground budgetary management","address":"779 West Pass","city":"Boulder","country":"United States"},
{"id":8,"name":"Effertz-Wolf","industry":"Computer Software: Programming, Data Processing","active":true,"website":"https://toplist.cz","telephone":"757-815-4826","slogan":"Monitored bandwidth-monitored encoding","address":"52687 Hovde Junction","city":"Chesapeake","country":"United States"},
{"id":9,"name":"Howe and Sons","industry":"Major Pharmaceuticals","active":false,"website":"https://mozilla.com","telephone":"981-800-8161","slogan":"Centralized bifurcated database","address":"724 Loomis Hill","city":"Blainville","country":"Canada"},
{"id":10,"name":"Bosco LLC","industry":"Major Pharmaceuticals","active":true,"website":"http://hao123.com","telephone":"924-994-0064","slogan":"Compatible human-resource capability","address":"52 Blue Bill Park Point","city":"Lions Bay","country":"Canada"},
{"id":11,"name":"Bayer and Sons","industry":"Real Estate Investment Trusts","active":true,"website":"http://unblog.fr","telephone":"187-321-4674","slogan":"Multi-channelled systematic policy","address":"574 Monterey Place","city":"Swift Current","country":"Canada"},
{"id":12,"name":"Fay-Pagac","industry":"Major Pharmaceuticals","active":true,"website":"https://exblog.jp","telephone":"402-653-7286","slogan":"Devolved secondary synergy","address":"96512 Milwaukee Trail","city":"Saskatoon","country":"Canada"},
{"id":13,"name":"Bergnaum, Wintheiser and Halvorson","industry":"Natural Gas Distribution","active":true,"website":"https://dailymail.co.uk","telephone":"316-935-8723","slogan":"Programmable discrete focus group","address":"223 Briar Crest Place","city":"Wichita","country":"United States"},
{"id":14,"name":"Friesen-Torp","industry":"Major Pharmaceuticals","active":false,"website":"http://rakuten.co.jp","telephone":"337-136-3450","slogan":"Configurable even-keeled customer loyalty","address":"7 John Wall Street","city":"Lafayette","country":"United States"},
{"id":15,"name":"Abernathy, Block and Kuhlman","industry":"Precious Metals","active":true,"website":"https://mapy.cz","telephone":"304-297-7591","slogan":"Sharable neutral capability","address":"5203 Barby Terrace","city":"Charleston","country":"United States"},
{"id":16,"name":"Bashirian, Hyatt and Hayes","industry":"EDP Services","active":false,"website":"https://umn.edu","telephone":"409-104-1651","slogan":"Secured cohesive utilisation","address":"12 Jay Alley","city":"Beaumont","country":"United States"},
{"id":17,"name":"Daniel, Roob and Reynolds","industry":"Biotechnology: In Vitro & In Vivo Diagnostic Substances","active":true,"website":"https://state.gov","telephone":"305-413-2995","slogan":"Automated asynchronous secured line","address":"2 Buell Junction","city":"Miami Beach","country":"United States"},
{"id":18,"name":"Brekke, Hackett and Wisozk","industry":"n/a","active":true,"website":"http://wix.com","telephone":"202-206-2827","slogan":"Focused local time-frame","address":"590 Vahlen Hill","city":"Washington","country":"United States"},
{"id":19,"name":"Ledner LLC","industry":"n/a","active":true,"website":"https://godaddy.com","telephone":"857-562-8396","slogan":"Function-based needs-based protocol","address":"2087 Pearson Pass","city":"Boston","country":"United States"},
{"id":20,"name":"Yundt, Kirlin and Jaskolski","industry":"Computer Software: Programming, Data Processing","active":false,"website":"https://ucoz.com","telephone":"757-740-1457","slogan":"Multi-channelled dynamic structure","address":"035 Kipling Crossing","city":"Virginia Beach","country":"United States"},
{"id":21,"name":"O'Conner-Hickle","industry":"n/a","active":false,"website":"https://macromedia.com","telephone":"302-730-2760","slogan":"Inverse eco-centric encryption","address":"1546 Debs Way","city":"Newark","country":"United States"},
{"id":22,"name":"Reynolds, Wiza and Schneider","industry":"n/a","active":false,"website":"http://salon.com","telephone":"915-107-2321","slogan":"Proactive fresh-thinking data-warehouse","address":"27 Bluestem Trail","city":"El Paso","country":"United States"},
{"id":23,"name":"Johns, Wunsch and Labadie","industry":"Electrical Products","active":true,"website":"https://vimeo.com","telephone":"407-333-1491","slogan":"Reverse-engineered discrete structure","address":"9861 Riverside Alley","city":"Orlando","country":"United States"},
{"id":24,"name":"Schowalter, Bashirian and Rowe","industry":"Finance: Consumer Services","active":true,"website":"http://t.co","telephone":"936-195-4981","slogan":"Extended optimal success","address":"69 Melrose Avenue","city":"Penticton","country":"Canada"},
{"id":25,"name":"Gorczany, Dibbert and Goodwin","industry":"Specialty Insurers","active":false,"website":"https://google.nl","telephone":"916-508-0891","slogan":"Upgradable even-keeled model","address":"3946 Ryan Court","city":"Sacramento","country":"United States"}]