[{"id":26,"name":"Bode and Sons","industry":"Other Consumer Services","active":true,"website":"https://devhub.com","telephone":"304-534-5956","slogan":"Monitored system-worthy pricing structure","address":"5 Atwood Road","city":"Charleston","country":"United States"},
{"id":27,"name":"Murphy-Witting","industry":"Packaged Foods","active":false,"website":"http://purevolume.com","telephone":"301-578-5980","slogan":"Advanced fault-tolerant initiative","address":"67 Hanson Court","city":"Hyattsville","country":"United States"},
{"id":28,"name":"Ondricka, Volkman and Berge","industry":"Marine Transportation","active":true,"website":"http://google.fr","telephone":"301-949-6857","slogan":"Innovative transitional process improvement","address":"6502 Barnett Point","city":"Hyattsville","country":"United States"},
{"id":29,"name":"Jenkins-Romaguera","industry":"Savings Institutions","active":false,"website":"http://e-recht24.de","telephone":"212-474-3727","slogan":"Cloned executive interface","address":"234 Twin Pines Point","city":"Miramichi","country":"Canada"},
{"id":30,"name":"Ward-Blanda","industry":"n/a","active":true,"website":"https://seattletimes.com","telephone":"417-449-7373","slogan":"Right-sized actuating hub","address":"12191 Montana Alley","city":"Springfield","country":"United States"},
{"id":31,"name":"Simonis LLC","industry":"Finance: Consumer Services","active":true,"website":"http://mlb.com","telephone":"254-326-5067","slogan":"Visionary leading edge artificial intelligence","address":"68649 Cascade Place","city":"Waco","country":"United States"},
{"id":32,"name":"Nicolas, Lockman and Keeling","industry":"n/a","active":true,"website":"http://pagesperso-orange.fr","telephone":"480-204-7726","slogan":"Automated disintermediate access","address":"2 Weeping Birch Junction","city":"Tempe","country":"United States"},
{"id":33,"name":"McClure-McCullough","industry":"Major Banks","active":false,"website":"http://flickr.com","telephone":"325-234-1724","slogan":"User-friendly radical internet solution","address":"4 Cherokee Hill","city":"San Angelo","country":"United States"},
{"id":34,"name":"Stanton, O'Reilly and Streich","industry":"Containers/Packaging","active":true,"website":"https://army.mil","telephone":"827-652-0885","slogan":"Self-enabling asynchronous structure","address":"75 Badeau Lane","city":"Keswick","country":"Canada"}]