[{"id":72,"name":"Lakin, Upton and Emard","industry":"n/a","active":true,"website":"http://histats.com","telephone":"918-436-1656","slogan":"Mandatory client-driven frame","address":"2010 Veith Alley","city":"Tulsa","country":"United States"},
{"id":73,"name":"Murazik and Sons","industry":"Property-Casualty Insurers","active":false,"website":"http://bloglovin.com","telephone":"336-591-8382","slogan":"Assimilated well-modulated approach","address":"3917 Express Center","city":"Winston Salem","country":"United States"},
{"id":74,"name":"Purdy, Koepp and Zboncak","industry":"Department/Specialty Retail Stores","active":true,"website":"https://redcross.org","telephone":"352-748-5551","slogan":"Phased demand-driven functionalities","address":"2502 Ryan Hill","city":"Gainesville","country":"United States"},
{"id":75,"name":"Kunze Group","industry":"Oil & Gas Production","active":true,"website":"https://virginia.edu","telephone":"841-440-6095","slogan":"Vision-oriented mission-critical capacity","address":"15 Forest Run Court","city":"Cochrane","country":"Canada"},
{"id":76,"name":"Carter LLC","industry":"n/a","active":false,"website":"https://gizmodo.com","telephone":"937-443-7729","slogan":"Cross-group analyzing core","address":"675 Cambridge Court","city":"Dayton","country":"United States"},
{"id":77,"name":"Monahan, Hintz and Kunze","industry":"Property-Casualty Insurers","active":false,"website":"https://edublogs.org","telephone":"589-359-2617","slogan":"Fundamental bifurcated moderator","address":"558 Carioca Hill","city":"Sainte-Anne-des-Monts","country":"Canada"},
{"id":78,"name":"Kub, Hoppe and Dach","industry":"Real Estate","active":false,"website":"http://rambler.ru","telephone":"792-250-9413","slogan":"Synchronised scalable groupware","address":"101 Di Loreto Junction","city":"Dieppe","country":"Canada"},
{"id":79,"name":"Hessel Group","industry":"n/a","active":true,"website":"http://buzzfeed.com","telephone":"540-111-9690","slogan":"Automated asynchronous application","address":"090 Troy Way","city":"Roanoke","country":"United States"},
{"id":80,"name":"Collins and Sons","industry":"Hotels/Resorts","active":false,"website":"http://yelp.com","telephone":"303-424-8972","slogan":"Triple-buffered executive collaboration","address":"31 Buhler Terrace","city":"Denver","country":"United States"},
{"id":81,"name":"Rempel, Dicki and Graham","industry":"EDP Services","active":false,"website":"https://shop-pro.jp","telephone":"204-296-9293","slogan":"Ergonomic coherent conglomeration","address":"9046 Dahle Point","city":"Mascouche","country":"Canada"},
{"id":82,"name":"Hodkiewicz LLC","industry":"Real Estate Investment Trusts","active":false,"website":"http://godaddy.com","telephone":"232-784-6056","slogan":"Public-key directional array","address":"0016 Twin Pines Drive","city":"Aylmer","country":"Canada"},
{"id":83,"name":"Wolf-Gislason","industry":"n/a","active":false,"website":"https://hubpages.com","telephone":"125-897-3984","slogan":"Virtual fresh-thinking matrices","address":"7484 Burning Wood Court","city":"Waitara","country":"New Zealand"},
{"id":84,"name":"Little, Abernathy and Marvin","industry":"n/a","active":true,"website":"http://wiley.com","telephone":"645-724-1733","slogan":"Front-line scalable database","address":"5 Drewry Lane","city":"Brisbane","country":"Australia"},
{"id":85,"name":"Satterfield, Tillman and Zboncak","industry":"Marine Transportation","active":true,"website":"https://marketwatch.com","telephone":"399-229-6601","slogan":"Optional static implementation","address":"877 Wayridge Circle","city":"Sarnia","country":"Canada"},
{"id":86,"name":"Dibbert, Ernser and Schmeler","industry":"n/a","active":true,"website":"http://stanford.edu","telephone":"316-647-0578","slogan":"Fundamental leading edge definition","address":"7667 Mendota Hill","city":"Wichita","country":"United States"},
{"id":87,"name":"Schmeler, Jacobs and Tromp","industry":"n/a","active":true,"website":"http://surveymonkey.com","telephone":"971-122-8321","slogan":"Right-sized 5th generation info-mediaries","address":"01 Tennyson Junction","city":"Portland","country":"United States"},
{"id":88,"name":"Spinka, Boehm and Osinski","industry":"Restaurants","active":false,"website":"https://angelfire.com","telephone":"913-872-2823","slogan":"Optimized zero defect secured line","address":"619 Farmco Place","city":"Delaware","country":"Canada"},
{"id":89,"name":"Langworth-Johnson","industry":"Specialty Chemicals","active":false,"website":"https://mozilla.org","telephone":"773-196-9862","slogan":"Decentralized neutral project","address":"7 Badeau Court","city":"Chicago","country":"United States"},
{"id":90,"name":"Fay, Hoppe and Goodwin","industry":"Natural Gas Distribution","active":true,"website":"http://eepurl.com","telephone":"323-745-1776","slogan":"Up-sized cohesive knowledge base","address":"2992 Clemons Center","city":"Los Angeles","country":"United States"},
{"id":91,"name":"Johns Inc","industry":"n/a","active":true,"website":"https://newsvine.com","telephone":"414-203-3203","slogan":"Balanced even-keeled extranet","address":"703 Portage Plaza","city":"Milwaukee","country":"United States"},
{"id":92,"name":"Rodriguez, Skiles and Predovic","industry":"n/a","active":true,"website":"https://surveymonkey.com","telephone":"760-324-1444","slogan":"Virtual optimizing function","address":"579 American Road","city":"Huntington Beach","country":"United States"},
{"id":93,"name":"Lowe, Bosco and Huels","industry":"Commercial Banks","active":true,"website":"https://marketwatch.com","telephone":"754-274-4874","slogan":"Focused clear-thinking definition","address":"6932 Prairieview Road","city":"Fort Lauderdale","country":"United States"},
{"id":94,"name":"Grady LLC","industry":"Home Furnishings","active":false,"website":"https://theguardian.com","telephone":"678-377-7740","slogan":"Operative eco-centric initiative","address":"3 West Way","city":"Raymond","country":"Canada"},
{"id":95,"name":"Grant-Anderson","industry":"n/a","active":false,"website":"https://com.com","telephone":"318-661-8576","slogan":"Down-sized non-volatile internet solution","address":"9460 Barnett Park","city":"Shreveport","country":"United States"},
{"id":96,"name":"Pacocha and Sons","industry":"Forest Products","active":false,"website":"http://technorati.com","telephone":"215-556-0856","slogan":"Automated full-range migration","address":"82 Stephen Plaza","city":"Philadelphia","country":"United States"},
{"id":97,"name":"Emmerich-Nicolas","industry":"Major Banks","active":false,"website":"http://weibo.com","telephone":"387-152-1473","slogan":"Programmable static process improvement","address":"5583 Hauk Way","city":"Waihi","country":"New Zealand"},
{"id":98,"name":"Collier-Roberts","industry":"Containers/Packaging","active":false,"website":"https://opensource.org","telephone":"100-799-8031","slogan":"Balanced empowering approach","address":"30594 Mendota Parkway","city":"Prince Edward","country":"Canada"},
{"id":99,"name":"Kertzmann-Miller","industry":"Major Pharmaceuticals","active":true,"website":"https://youtube.com","telephone":"962-756-2238","slogan":"Synchronised foreground encoding","address":"94405 Ridgeway Street","city":"Richmond","country":"New Zealand"},
{"id":100,"name":"Schiller, Moore and Stark","industry":"Multi-Sector Companies","active":true,"website":"http://reverbnation.com","telephone":"617-883-4147","slogan":"Ameliorated coherent function","address":"14825 Elka Avenue","city":"Boston","country":"United States"}]