[{"id":26,"name":"Bode and Sons","industry":"Other Consumer Services","active":true,"website":"https://devhub.com","telephone":"304-534-5956","slogan":"Monitored system-worthy pricing structure","address":"5 Atwood Road","city":"Charleston","country":"United States"},
{"id":27,"name":"Murphy-Witting","industry":"Packaged Foods","active":false,"website":"http://purevolume.com","telephone":"301-578-5980","slogan":"Advanced fault-tolerant initiative","address":"67 Hanson Court","city":"Hyattsville","country":"United States"}]