[{"id":35,"name":"Moen-Harber","industry":"Major Banks","active":false,"website":"http://live.com","telephone":"704-344-3368","slogan":"Object-based uniform monitoring","address":"5663 Pawling Park","city":"Charlotte","country":"United States"},
{"id":36,"name":"Pouros, Murphy and Vandervort","industry":"Major Chemicals","active":false,"website":"http://cdbaby.com","telephone":"702-618-0399","slogan":"Devolved bandwidth-monitored solution","address":"04333 Fuller Park","city":"Saint-Bruno-de-Montarville","country":"Canada"},
{"id":37,"name":"Crooks-Russel","industry":"Major Banks","active":false,"website":"https://nps.gov","telephone":"202-131-9615","slogan":"Grass-roots secondary contingency","address":"52532 Parkside Circle","city":"Washington","country":"United States"},
{"id":38,"name":"Schumm, Kohler and Yundt","industry":"Oil & Gas Production","active":false,"website":"http://spiegel.de","telephone":"570-272-9649","slogan":"Fundamental eco-centric extranet","address":"1 Mccormick Trail","city":"Scranton","country":"United States"},
{"id":39,"name":"Satterfield-MacGyver","industry":"Oil & Gas Production","active":true,"website":"https://gmpg.org","telephone":"512-453-3403","slogan":"Managed radical approach","address":"12112 Express Alley","city":"Austin","country":"United States"},
{"id":40,"name":"Stokes, Dooley and Muller","industry":"Industrial Machinery/Components","active":false,"website":"http://paypal.com","telephone":"816-227-7107","slogan":"Sharable modular policy","address":"127 Magdeline Place","city":"Kansas City","country":"United States"},
{"id":41,"name":"Terry LLC","industry":"Telecommunications Equipment","active":true,"website":"http://clickbank.net","telephone":"529-130-7939","slogan":"Customer-focused dynamic algorithm","address":"8 Mendota Trail","city":"Virden","country":"Canada"},
{"id":42,"name":"Weber, Gislason and Huel","industry":"Commercial Banks","active":true,"website":"http://berkeley.edu","telephone":"470-408-7066","slogan":"Front-line even-keeled local area network","address":"6122 Mcguire Road","city":"Sarnia","country":"Canada"},
{"id":43,"name":"Rosenbaum Inc","industry":"Savings Institutions","active":true,"website":"http://cornell.edu","telephone":"719-887-9989","slogan":"Automated regional core","address":"585 Green Road","city":"Colorado Springs","country":"United States"},
{"id":44,"name":"Pacocha-Lowe","industry":"Major Banks","active":true,"website":"http://usda.gov","telephone":"812-947-8340","slogan":"Team-oriented explicit ability","address":"95 Anthes Alley","city":"Bloomington","country":"United States"},
{"id":45,"name":"Schmitt-Blick","industry":"n/a","active":true,"website":"https://blogs.com","telephone":"-305-5106","slogan":"Switchable high-level local area network","address":"37002 Scoville Drive","city":"Pittsburgh","country":"United States"},
{"id":46,"name":"Koelpin-Wuckert","industry":"Food Distributors","active":true,"website":"https://storify.com","telephone":"714-360-8144","slogan":"Pre-emptive motivating product","address":"216 Texas Plaza","city":"Fullerton","country":"United States"},
{"id":47,"name":"Nitzsche, Monahan and Cartwright","industry":"Biotechnology: Laboratory Analytical Instruments","active":false,"website":"https://technorati.com","telephone":"804-874-6804","slogan":"Optional holistic capability","address":"551 Corben Plaza","city":"Fermont","country":"Canada"},
{"id":48,"name":"Tremblay-Walsh","industry":"EDP Services","active":true,"website":"https://senate.gov","telephone":"670-875-9817","slogan":"Synergistic tertiary service-desk","address":"3 Sage Terrace","city":"Pont-Rouge","country":"Canada"},
{"id":49,"name":"Ullrich Inc","industry":"n/a","active":false,"website":"http://posterous.com","telephone":"179-150-7800","slogan":"Right-sized fresh-thinking migration","address":"1 Shasta Place","city":"Pleasant Point","country":"New Zealand"},
{"id":50,"name":"Von, Osinski and Stiedemann","industry":"Investment Managers","active":false,"website":"http://icq.com","telephone":"225-995-6141","slogan":"Cloned multi-tasking algorithm","address":"2 Calypso Circle","city":"Wolfville","country":"Canada"},
{"id":51,"name":"Metz, Pfannerstill and Wehner","industry":"Real Estate Investment Trusts","active":false,"website":"https://liveinternet.ru","telephone":"259-581-3088","slogan":"Polarised discrete interface","address":"03855 Hintze Pass","city":"Carman","country":"Canada"},
{"id":52,"name":"Hammes Group","industry":"n/a","active":false,"website":"http://princeton.edu","telephone":"317-807-9486","slogan":"Pre-emptive actuating groupware","address":"7376 Muir Road","city":"Seminole","country":"United States"},
{"id":53,"name":"Metz Group","industry":"Computer Communications Equipment","active":false,"website":"https://hugedomains.com","telephone":"860-252-0758","slogan":"Organized full-range moratorium","address":"63408 Gale Alley","city":"Hartford","country":"United States"},
{"id":54,"name":"Rodriguez, Lebsack and Gutkowski","industry":"Radio And Television Broadcasting And Communications Equipment","active":true,"website":"https://bloglovin.com","telephone":"406-546-8960","slogan":"Persistent local intranet","address":"47 Glendale Point","city":"Pierreville","country":"Canada"},
{"id":55,"name":"Bogan Inc","industry":"Business Services","active":false,"website":"http://xrea.com","telephone":"469-784-7011","slogan":"Visionary context-sensitive definition","address":"35 Ramsey Terrace","city":"Anmore","country":"Canada"},
{"id":56,"name":"Collier, Ziemann and Smitham","industry":"Office Equipment/Supplies/Services","active":true,"website":"http://ucoz.com","telephone":"475-540-9996","slogan":"Cross-platform high-level circuit","address":"703 Roxbury Junction","city":"Forestville","country":"Canada"},
{"id":57,"name":"Cole, Becker and Schiller","industry":"Biotechnology: Biological Products (No Diagnostic Substances)","active":false,"website":"http://cargocollective.com","telephone":"814-157-5995","slogan":"Virtual mobile pricing structure","address":"83 Bultman Center","city":"Little Current","country":"Canada"},
{"id":58,"name":"Heidenreich Group","industry":"n/a","active":false,"website":"http://state.gov","telephone":"615-361-5459","slogan":"User-centric zero defect migration","address":"79677 Shoshone Junction","city":"Nashville","country":"United States"},
{"id":59,"name":"Schuster-Turner","industry":"Other Consumer Services","active":false,"website":"http://intel.com","telephone":"922-943-7768","slogan":"Open-architected exuding knowledge user","address":"3731 Moose Point","city":"Oakville","country":"Canada"},
{"id":60,"name":"Wunsch-Schimmel","industry":"Real Estate","active":false,"website":"https://mayoclinic.com","telephone":"979-937-2645","slogan":"Up-sized static encoding","address":"790 Pleasure Point","city":"Bryan","country":"United States"},
{"id":61,"name":"Nicolas, Zemlak and Schaefer","industry":"Marine Transportation","active":false,"website":"http://163.com","telephone":"560-846-9524","slogan":"Reduced well-modulated hardware","address":"903 Sutherland Lane","city":"Sheffield","country":"United Kingdom"},
{"id":62,"name":"Wolf-Orn","industry":"n/a","active":true,"website":"http://hugedomains.com","telephone":"719-881-1294","slogan":"Total solution-oriented moderator","address":"32 Mandrake Junction","city":"Pueblo","country":"United States"},
{"id":63,"name":"Kessler, Bins and Yundt","industry":"Major Pharmaceuticals","active":true,"website":"https://fastcompany.com","telephone":"801-358-4475","slogan":"Persistent dedicated array","address":"2391 Union Court","city":"Salt Lake City","country":"United States"},
{"id":64,"name":"Hills-Nolan","industry":"Real Estate Investment Trusts","active":false,"website":"https://bbc.co.uk","telephone":"339-188-1693","slogan":"Customer-focused fresh-thinking definition","address":"9 Maryland Circle","city":"Port Colborne","country":"Canada"},
{"id":65,"name":"Abshire-O'Keefe","industry":"Investment Bankers/Brokers/Service","active":true,"website":"http://cpanel.net","telephone":"504-276-9009","slogan":"Self-enabling dynamic knowledge base","address":"70 Brentwood Terrace","city":"New Orleans","country":"United States"},
{"id":66,"name":"Stokes, Harber and Howe","industry":"Air Freight/Delivery Services","active":false,"website":"https://wordpress.com","telephone":"214-301-1432","slogan":"Multi-channelled multi-tasking instruction set","address":"908 Mallard Junction","city":"Mesquite","country":"United States"},
{"id":67,"name":"Hilll Group","industry":"Commercial Banks","active":true,"website":"https://slideshare.net","telephone":"965-854-3660","slogan":"Reduced methodical intranet","address":"7912 Crest Line Park","city":"Edinburgh","country":"United Kingdom"},
{"id":68,"name":"Kuhlman-Huel","industry":"Major Pharmaceuticals","active":true,"website":"https://dailymail.co.uk","telephone":"203-311-7880","slogan":"Inverse leading edge parallelism","address":"937 Independence Junction","city":"Waterbury","country":"United States"},
{"id":69,"name":"Bahringer-Emmerich","industry":"Integrated oil Companies","active":false,"website":"https://wikimedia.org","telephone":"239-920-6390","slogan":"Profound system-worthy Graphic Interface","address":"4478 Anzinger Road","city":"Fort Myers","country":"United States"},
{"id":70,"name":"Marvin Inc","industry":"Major Banks","active":true,"website":"http://free.fr","telephone":"277-545-8582","slogan":"Enhanced analyzing internet solution","address":"59 Dunning Drive","city":"Saskatoon","country":"Canada"},
{"id":71,"name":"Armstrong, Dooley and Hudson","industry":"Restaurants","active":false,"website":"http://webmd.com","telephone":"110-709-1242","slogan":"Right-sized cohesive website","address":"1 Brickson Park Parkway","city":"Neepawa","country":"Canada"}]